{
  "$schema": "../schemas/publication_style_rules.v1.schema.json",
  "schema_version": "publication_style_rules.v1",
  "updated_at": "2026-05-27",
  "policy": "Use high-impact journal craft and target-journal style evidence as style and audit layers for social-science work. Scientific-figure and manuscript-writing standards are absorbed as local contracts, but they do not replace Chinese journal conventions, humanities/social-science evidence logic, route control, image2 boundaries, citation verification, reproducibility contracts, or author-owned claims.",
  "source_review_ref": "skills/catalog/external_adoption_reviews.json#Yuan1z0825/nature-skills; skills/catalog/external_adoption_reviews.json#myzhao0114-del/scientific-figure-skill; skills/catalog/external_adoption_reviews.json#Leey21/awesome-ai-research-writing; skills/catalog/external_adoption_reviews.json#ganzhi-black/humanities-thesis-skill; skills/catalog/external_adoption_reviews.json#brycewang-stanford/Awesome-Agent-Skills-for-Empirical-Research; skills/catalog/external_adoption_reviews.json#WantongC/journal-adapt-writing-skill",
  "figure_table": {
    "owner_skill": "research-figure-studio",
    "target_routes": [
      "research-figure-design",
      "computational-social-science",
      "social-science-submission-package",
      "empirical-quant",
      "text-corpus",
      "network-analysis"
    ],
    "rules": [
      {
        "id": "figure_claim_contract",
        "label": "图表先定义要证明的结论",
        "requirement": "绘图前必须写清图表要支撑的中心判断、分析单位、样本范围、时间窗口、变量口径和审稿风险。",
        "social_science_adaptation": "社科图表不能只追求漂亮，必须说明它服务于理论命题、识别策略、测量效度、机制解释、异质性或稳健性中的哪一个环节。",
        "upstream_inspiration": "nature-figure 的 figure contract 和 visual argument 规则。",
        "examples": [
          "回归系数图先说明核心解释变量、参照组和置信区间含义。",
          "事件研究图先说明处理时点、基准期、平行趋势和动态效应解释。",
          "网络图先说明节点、边、窗口和布局是否只用于展示。"
        ]
      },
      {
        "id": "panel_evidence_hierarchy",
        "label": "多面板图按证据层级组织",
        "requirement": "多面板图必须形成主面板和支持面板的证据层级；每个面板回答一个不可被其他面板替代的问题。",
        "social_science_adaptation": "优先组织成 描述事实 -> 主要估计 -> 机制或异质性 -> 稳健性 的证据链，避免把多个相似模型堆成视觉拼盘。",
        "upstream_inspiration": "nature-figure 的 overview -> deviation -> relationship 和 unique panel question 规则。",
        "examples": [
          "Panel A 展示样本和趋势，Panel B 展示主效应，Panel C 展示机制，Panel D 展示稳健性。",
          "文本分析图可以用主题分布、时间变化和代表性语料片段形成层级。"
        ]
      },
      {
        "id": "publication_visual_style",
        "label": "白底、克制配色和可编辑矢量输出",
        "requirement": "论文图默认白底，使用克制配色；同一概念在所有面板中保持同一色系；优先输出可编辑 SVG/PDF，PNG 只作预览或投稿辅助。",
        "social_science_adaptation": "社科图表常用于黑白打印、审稿 PDF 和后续编辑，需避免高饱和多色、重复图例和不可编辑文字。",
        "upstream_inspiration": "nature-figure 的 typography、palette、SVG first、legend economy 和 direct labelling 规则。",
        "examples": [
          "同一政策组、处理组或模型族在所有面板中保持一致颜色。",
          "优先使用直接标签或共享图例，避免每个子图重复图例。",
          "回归表和图注要记录数据来源、模型设定和不确定性含义。"
        ]
      },
      {
        "id": "caption_source_traceability",
        "label": "图注承担证据链",
        "requirement": "图注或表注必须说明展示对象、单位、样本、模型或统计口径、误差条含义、数据来源和可复现脚本位置。",
        "social_science_adaptation": "投稿图表必须能让审稿人不回看代码也能理解图表证据，不得用图表美化掩盖样本、口径或模型差异。",
        "upstream_inspiration": "nature-figure 把 statistics、n、source data 和 review risk 纳入图表契约的做法。",
        "examples": [
          "误差条明确为 95% 置信区间、标准误或标准差。",
          "表注说明固定效应、聚类标准误、控制变量组和样本限制。"
        ]
      },
      {
        "id": "top_journal_empirical_graph_conventions",
        "label": "遵守社科顶刊图形惯例",
        "requirement": "论文图默认使用白底、克制配色、统一字体、清晰坐标、明确单位、可读图例和可黑白阅读设计；多面板图要使用简短、有实质含义的面板标签。",
        "social_science_adaptation": "社科顶刊图通常服务于理论主张、识别逻辑、机制解释或稳健性展示；图形应降低审稿人理解成本，而不是增加视觉噪音。",
        "upstream_inspiration": "ASR、SMR、AJPS、AEA、APSA 和本机 AJS/ASR/SMR/PNAS 样本中的图形惯例。",
        "examples": [
          "系数图必须标出参照组、估计值、置信区间和变量口径。",
          "研究设计图必须说明样本进入、排除、测量和模型输出。",
          "机制图的箭头必须有真实含义，不能只作装饰。"
        ]
      },
      {
        "id": "image2_locked_structure_contract",
        "label": "image2 可用但必须先锁定结构",
        "requirement": "科研图不得因为使用 image2 而被直接拒绝；但在调用 image2 前必须锁定图型、面板、可见文字、箭头关系、配色和禁止编造项。",
        "social_science_adaptation": "机制图、概念框架图、研究流程图和非数值科研插图可以用 image2 生成；精确数据图必须先由代码或可编辑工具控制数据和坐标。",
        "upstream_inspiration": "Nature-style figure contract 与本地用户对 image2 科研图工作流的明确要求。",
        "examples": [
          "先写出所有中文标签，再生成白底多面板机制图。",
          "不得让 image2 生成样本量、p 值、坐标轴刻度或 DOI。",
          "若 image2 文字错误，保留视觉结构并用 SVG、HTML、PPT 或编辑工具修正文字。"
        ]
      },
      {
        "id": "figure_brief_before_rendering",
        "label": "渲染前必须有图形说明卡",
        "requirement": "正式绘图前必须形成 figure brief，至少包括图的用途、论文主张、图型、数据或概念依据、面板计划、文字标签、连接线、渲染工具和风险检查。",
        "social_science_adaptation": "这可以防止不同线程把同一科研图画成不同含义，也能让顶刊审稿关心的样本、变量、证据和边界提前显性化。",
        "upstream_inspiration": "nature-figure 的 figure contract、AJPS 的多面板均衡要求和社科顶刊图注自解释要求。",
        "examples": [
          "图 1 是理论机制图，依据是本文理论框架，不含经验数值。",
          "图 2 是事件研究图，依据是项目数据和 Stata/Python 输出。"
        ]
      },
      {
        "id": "config_block_reproducibility",
        "label": "配置区前置",
        "requirement": "结构化数据科研图的脚本必须在顶部集中声明输入路径、输出目录、字体 fallback、输出格式、显著性阈值、误差线类型、数字精度、单栏/双栏尺寸和 DPI。",
        "social_science_adaptation": "社科经验图常经历多轮模型和图表版本调整；配置区前置可以保证同一项目的字体、字号、误差线、p 值显示和输出格式不随线程随机漂移。",
        "upstream_inspiration": "scientific-figure-skill 的 configuration block 和 centralized plotting defaults。",
        "examples": [
          "脚本顶部统一设置中文 SimSun/Songti fallback、英文 Times New Roman fallback、base 10 pt、tick 9 pt、DPI 300。",
          "显著性阈值、误差线类型和输出格式不散落在绘图函数内部。"
        ]
      },
      {
        "id": "data_health_before_plotting",
        "label": "画数据图前先做数据体检",
        "requirement": "Excel、CSV 或表格数据进入正式科研图前，必须先检查行列、字段类型、缺失、重复、描述统计、异常值、分布；回归或多预测变量图还要检查相关和 VIF 风险。",
        "social_science_adaptation": "社科图表经常被误用来放大脏数据或弱测量，数据体检可以在画图前阻断缺失率过高、样本过小、共线性严重或变量口径混乱的问题。",
        "upstream_inspiration": "scientific-figure-skill 的 00_data_health.md 规则。",
        "examples": [
          "关键变量缺失超过阈值时先报告，不直接画主结果图。",
          "模型图涉及多个连续变量时，至少说明相关或 VIF 风险。"
        ]
      },
      {
        "id": "process_data_traceability",
        "label": "每张图有过程数据留痕",
        "requirement": "正式经验图必须保留原始读取、清洗后、聚合后、统计检验和每张图对应的数据 sidecar；审稿人追问任一数字时，应能定位到文件、sheet 和列。",
        "social_science_adaptation": "社科审稿常要求复核样本口径、变量变换和模型输出；图表不能只留下最终 PNG，应保留 process_data 和脚本路径。",
        "upstream_inspiration": "scientific-figure-skill 的 process_data/ 和 fig_NN_data.xlsx 规则。",
        "examples": [
          "fig_02_coefficient_plot.pdf 对应 process_data/fig_02_data.xlsx。",
          "显著性星号对应 process_data/05_statistical_tests.xlsx。"
        ]
      },
      {
        "id": "justified_statistics_annotations",
        "label": "统计标注必须有研究设计依据",
        "requirement": "只有真实组间比较、模型估计或明确设计需要时才加显著性、p 值或误差条；误差条必须写明 SD、SEM、标准误或置信区间，p 值小于 0.001 时写 p < 0.001。",
        "social_science_adaptation": "社科论文常见的系数图、事件研究图和边际效应图应优先说明估计量和不确定性；不要把普通趋势图、散点图或单分布图强行加星号。",
        "upstream_inspiration": "scientific-figure-skill 的 statistics.md、p-value formatting 和 significance annotation guardrails。",
        "examples": [
          "配对与独立样本无法判断时先问用户，不擅自选择 t 检验。",
          "事件研究图说明置信区间和参照期，而不是只给星号。"
        ]
      },
      {
        "id": "typography_font_size_specification",
        "label": "字体字号有明确规格",
        "requirement": "正式图默认使用 serif 体系：中文 fallback 为 SimSun、Songti SC、Source Han Serif SC、Noto Serif CJK SC、serif；英文 fallback 为 Times New Roman、Liberation Serif、DejaVu Serif、serif。基础字号 10 pt，轴标题 10 pt，刻度和图例 9 pt，图注 9 pt，面板标签和显著性标注 10 pt。",
        "social_science_adaptation": "社科图表常在 Word、PDF、PPT 和投稿系统之间流转，字体字号必须稳定、可读、可替换；目标期刊有模板时可以调整，但必须记录取舍。",
        "upstream_inspiration": "scientific-figure-skill 的 chart_style.md、config_template.md 和 pdf_layout.md 字体字号默认值。",
        "examples": [
          "中文图使用宋体类 fallback，英文变量标签使用 Times 类 fallback。",
          "显著性星号不应大于主图文字；图例不应压过坐标轴。"
        ]
      },
      {
        "id": "figure_size_resolution_contract",
        "label": "图幅和分辨率有规格",
        "requirement": "正式图默认区分单栏约 3.5 x 2.6 inch、双栏约 7.2 x 4.0 inch；PNG/JPG 预览不低于 300 DPI，投稿和后续编辑优先保留 PDF、SVG、PPT 或脚本。",
        "social_science_adaptation": "社科论文图常需要嵌入正文和附录，尺寸必须服务版面与可读性；JPG 只能作为兼容格式，不能替代可编辑或矢量来源。",
        "upstream_inspiration": "scientific-figure-skill 的 single-column/double-column sizing、DPI 和 multi-format export 默认值。",
        "examples": [
          "单栏系数图保持 9 pt 刻度可读，不为了塞入过多变量而压缩字号。",
          "多面板图优先双栏尺寸或拆分为主图和附录图。"
        ]
      },
      {
        "id": "caption_what_how_so_what",
        "label": "图注说明展示、方法和结论",
        "requirement": "正式图注必须包含 what、how、so what：展示对象，汇总或检验方法，读者应得出的有边界结论；不得只复述坐标轴。",
        "social_science_adaptation": "社科图注还应说明单位、样本、时间窗口、模型或统计口径、误差条含义、数据来源和脚本位置；结论不能超过图中证据。",
        "upstream_inspiration": "scientific-figure-skill 的 three-part caption rule。",
        "examples": [
          "Figure 2. Coefficients from the baseline fixed-effects model... Whiskers denote 95% confidence intervals... The effect is concentrated after the policy shock.",
          "中文图注同样需要展示对象、方法口径和边界结论。"
        ]
      },
      {
        "id": "multi_format_export_and_editable_source",
        "label": "多格式和可编辑来源一起交付",
        "requirement": "正式经验图默认保留高质量图件、预览图、绘图数据 sidecar、统计检验表和脚本；PDF/PNG/JPG 可以作为兼容组合，但本地投稿链优先保留 PDF/SVG/PPT 或脚本。",
        "social_science_adaptation": "这避免论文改稿时只能重画图片，也让送审包、复现包和图文一致性检查能追溯版本。",
        "upstream_inspiration": "scientific-figure-skill 的 figures/pdf、figures/png、figures/jpg 和 process_data 目录约定。",
        "examples": [
          "交付时列出 figures/pdf、figures/png、process_data 和脚本路径。",
          "仅有 JPG 的图不能作为最终送审图表通过。"
        ]
      },
      {
        "id": "renderer_selection_by_deliverable",
        "label": "按交付目标选择制图工具",
        "requirement": "正式制图前必须根据最终用途、数据形态、统计建模需求、是否需要可见桌面自动化、复现要求和协作约束，选择 R、Python、PowerPoint、矢量工具、表格软件或 image2。",
        "social_science_adaptation": "社科经验图优先使用可复现代码；机制图、概念图和研究流程图可使用 image2；展示型 PPT 图墙可以用 PowerPoint 或 presentation 工具，但不能替代论文图表的源数据和脚本。",